id_review_main,review_rating,review_text
review_227,5,"มารอบที่ 4 แล้ว! มารอลูกชายเลิกเรียนพร้อมทำงานได้ด้วย คือดี คาเฟ่ใกล้ฉัน!!!
มัทฉะ+นมธัญพืช(หวาน 0%) อร่อยมาก
ข้าวไก่คั่วพริกเกลือ ท้อปไข่ดาวไม่สุก 2 ฟองอร่อยจริงจัง ไม่เคยเปลี่ยนเมนูเลย ราคาน่ารัก"
review_227,5,ใคาที่เบื่อระหว่างปักชุดนักเรียนแล้วขี้เกียจกลับบ้านอบากนั่งอะไรเย็นๆหรือหิวข้าวแนะนำร้านนี้เลยบริการดีมากและแอร์เย็นเจียบ กาแฟหอมมากคะ่วเข้มดีต่อใจและคอฟเฟิลดีสุดๆค่ะ พนักงานน่ารักค่ะ❤️❤️❤️❤️
review_227,5,อาหารและกาแฟได้เร็ว กาแฟรสชาติดีครับ อาหารอร่อย สามารถจอดรถได้หน้าร้าน
review_227,5,"มาครั้งที่ 2 แล้วค่า ราคาดีมาก มีที่จอดรถค่ะ
ชาไทยหวานน้อยอร่อยค่า มันๆนัวๆ
ครอฟเฟิลไอติมช็อคโกแลตก็อร่อย กรอบมากค่า
ร้านโล่งและกว้าง บรรยากาศสบายๆ
มีห้องน้ำสะอาดให้บริการด้วย
โดยรวมแล้วชอบมากๆค่า"
review_227,5,"อาหารอร่อย ร้านน่ารัก
บริการดี พี่เจ้าของน่ารัก
สามารถแวะมานั่งทำงานได้
ราคาอาหารเครื่องดื่มน่ารัก ไม่แพงค่ะ
ที่จอดข้างๆร้านได้ หน้าร้านได้ มาแวะอุดหนุนกันนะคะ"
review_227,5,เพิ่งเคยมาครั้งแรก รู้สึกชอบค่ะ บรรยากาศในร้านตกแต่งแนวมินิมอล ในความรู้สึกสบายๆชิวๆ จิบชา กาแฟ ฟังเพลงไปด้วย ร้านหาง่าย ราคาอาหารและเครื่องดื่มไม่แพง สำหรับหน้าร้อนนี้ใครยังหาคาเฟ่นั่งชิวๆไม่เจอ แนะนำที่นี่้เลยค่ะ Colon D cafe
review_227,5,อาหารอร่อย ราคาไม่แพงเลย เมนูกาแฟ ขนมและชาไทยก็อร่อย กาแฟมีให้เลือกทั้งคั่วเข้มและคั่วกลาง มีอาหารจานเดียว ของทานเล่น ขนมเค้กต่างๆ ไว้บริการ บรรยากาศในร้านโล่งโปร่งสบาย
review_227,5,บรรยายกาศ กาแฟ อาหารอร่อย เอาแก้วมาเอง ลด 5 บาท ด้วยค่ะ เป็นลูกค้าประจำร้านนี้เลย
review_227,5,เป็นคาเฟ่ที่ไม่ใหญ่มาก มีพื้นที่หลายมุมให้นั่งเงียบๆ มีมุมถ่ายรูปน่ารักก อาหารอร่อย เค้กเริ่ด😋 ครอฟเฟิลดี 100/10 โทสคือหอมเนยมากกกๆ 1000/10 มีโอกาสไปอีกแน่นอนค่ะ😁
review_227,5,คาเฟ่ตลาดรังสิต ที่จอดรถสะดวก ภายในร้านกว้างขวางโทนสีขาวสะอาด บริการดีมาก ขนมอร่อย เครื่องดื่มอร่อย ราคาถูก กลับมาใหม่แน่นอนค่ะ
review_227,5,"เค้ก red velvet
ชาเขียวสตรอเบอร์รี่ อร่อยเข้มข้นมากก🤤
มีที่นั่งเยอะ เสียบปลั๊กนั่งทำงานได้ด้วยนะ 💖"
review_227,4,"ร้านคาเฟ่ใกล้ตลาดรังสิตเลย หาที่จอดริมถนนเอา รอบๆร้าน ร้านค่อนข้างใหญ่ ใหม่สะอาด บรรยากาศโอเคเลย นั่งสบาย บริการดี มีขายทั้งขนม กาแฟ ทั้งอาหาร ห้องน้ำดีมาก

เราลองสั่ง สปาเกตตีแฮมพริกแห้งอร่อยดี คาโบนาร่าจืดไปนิด ยำมาม่าอร่อยแต่รสจัดเกิน ต้องรีดน้ำออก หมูมะนาวก็ดีรสโอเคเลยแต่กะหล่ำฝอยลวกสุกไปนิด น้ำเจิ่งๆไปหน่อย ชาเย็นอร่อยเลย  ลูกชอบมาก กาแฟเย็นกับครอฟเฟิ้ลโอเค แต่ขนมที่แนะนำเลยคือโทสเนยกับไอติม ดีมาก ขนมปังเหนียวนุ่ม หอมเนยน้ำตาล ถูกใจค่ะ"
review_227,5,"มาครั้งแรก แต่ดูรีวิวมาสักพัก ประทับใจมากพนักงานบริการดี แนะนำดีมาก และที่สำคัญวันที่มามีโปรโมชั่นแก้วที่2 ลด40 บาท ด้วย
เครื่องดื่มอร่อย ราคาไม่แพงเลยย ปักหมุดไว้เลย"
review_227,5,ไม่ผิดหวังเลยค่ะว่าเลือกมาอ่านหนังสือร้านนี้ พนักงานน่ารักมากเลยมีแจกอั่งเปาให้ด้วย ร้านเงียบสงบดีค่ะไว้จะกลับมาอีกแน่นอน
review_227,5,คาเฟ่ที่ตั้งอยู่แถวตลาดรังสิต มีที่จอดรถรอบๆร้าน  มาลองตามคำแนะนำใน google map ไม่ผิดหวัง ร้านสวย บรรยากาศดี เครื่องดื่มมีให้เลือกเยอะ รสชาติใช้ได้ มีอาหารด้วย สั่งสปาเกตตี้เบคอน พริกแห้ง อร่อยดี มีกล่องจุ่มให้บริการด้วยค่ะ สำหรับสายจุ่ม😘
review_227,5,"ร้านน่ารักบริการดี
🫶น้ำชาเขียวสตอเบอรี่อร่อยมาก
👏สปาเกตตีก็อร่อย
✨ร้านสะอาดห้องน้ำสะอาด"
review_227,5,ร้านน่ารักค่ะ ไปครั่งแรก ลองเมนู โฟลตอเมริกาโน่ไป ชอบมากๆ กาแฟเข้ม เมนูเยอะ ราคาไม่แพงเลย ร้านหาง่าย คลีนๆขาวๆ 💕
review_227,5,อาหารอร่อย เครื่องดื่มอร่อยทุกเมนู ชาเขียว กับ อเมน้ำผึ้งคือตรงใจมากเลย ไว้มีโอกาสจะแวะมาใหม่อีก
review_227,5,"Cafe‘ ลับในตลาดรังสิต เปิดมาได้ปีกว่า ๆ แล้ว แต่เพิ่งค้นพบ 555+

มีเมนูเครื่องดื่ม อาหาร ขนม และของกินเล่น ให้เลือกมากมาย"
review_227,5,ข้าวกระเพราะอร่อยมากค่ะ เมนูขนมก็ถูกใจ เพียวมัทฉะคือดีต่อใจมากกกกก มาร้านนี้2 รอบแล้วค่ะ แนะนำเลย
review_227,5,เครื่องดื่ม อาหารดี เหมาะมากเปลี่ยนที่ทำงาน มีปลั๊กและ wifi support  ราคาน่ารัก😊😊😊
review_227,5,บรรยากาศดี อาหารอร่อย มีบริการเครื่องดื่มหลากหลายชนิด สร้างความแตกต่างจากร้านอื่นในย่านึ้อย่างมาก แนะนำให้มาชิม จอดรถรอบๆร้านได้
review_227,5,ร้านตกแต่งเป็นโทนสีขาว สะอาดตา ขนมหวานอร่อย น้ำก็อร่อย พนักงานบริการดี เหมาะกับการมาพักผ่อนคลายเครียดจากการทำงาน แนะนำเลยค่ะ
review_227,5,"😳โทสอร่อยมากก หอมเนย
🌹✅น้ำชาเขียวสตอเบอรี่ก็อร่อย
😎มีที่จอด
✨บรรยากาศสะอาดตามาก ห้องน้ำก็สะอาด"
review_227,5,"กาแฟอร่อย มาทานตั้งแต่เปิดร้าน
เดี๋ยวนี้มีเมล็ดให้เลือกเยอะขึ้น
ร้านสะอาด น่ารัก มีมุมนั่งชิล ให้ถ่ายรูปหลายมุม
จอดรถข้างร้านและหน้าร้านได้
อาหารอร่อย โดยเฉพาะข้าวคั่วพริกเกลือ
ราคาไม่แพง พนักงานบริการดีแนะนำค่ะ"
review_227,5,กาแฟรสชาติดี บรรยากาศดี ร้านเงียบๆสบายๆ นั่งชิวๆหรือนั่งทำงานก็ได้
review_227,5,บรรยากาศดี อาหารดี กาแฟอร่อย ที่สำคัญมีโปรโมชั่นแก้วที่สอง 40 บาทค่ะ
review_227,5,"ใครที่คิดว่าสั่งคั่วกลางจะเปรี้ยวผมบอกเลยไม่เปรี้ยวอย่างที่คิดครับร้านนี้คั่วกลาง ""นัวๆ""เลยครับ

คั่วเข้มเป็นอีกตัวที่คนไม่ชอบBerryบอกเลยว่าเข้มมาก แต่Tasteดีนะทั้ง2ตัวเลย

บรรยากาศภายในกับความสะอาดของสีขาวที่ใช้พอดีกันครับ

ส่วนอาหารยังไม่ได้ลองน่าจะมีมาซ้ำแบบไม่ต้องสงสัยครับ"
review_227,5,ร้านนั่งสบาย บรรยากาศดี ไม่อึดอัด เจ้าของร้านแนะนำเครื่องดื่มได้ดี และอาหารรสชาติดี
review_227,5,เค้กส้มอร่อยมาก ไม่หวาน บวกกลิ่นและรสชาติส้มกินแล้วละลายในปาก กาแฟคาปูร้อนคั่วเข้มกลิ่นหอม ถูกใจคอกาแฟ  ร้านบรรยากาศดี บริการไว ใส่ใจลูกค้า.
review_227,5,"อาหารอร่อยค่ะ  สั่งหมูมะนาว และขนมจีบทอด   ชาไทย และคาปู มาทาน อร่อยทุกอย่างค่ะ
บรรยากาศ นั่งสบาย ๆ ชิว ๆ"
review_227,5,ร้านดีมากครับ บรรยากาศดี ภายในดูกว้างกว่ามองจากข้างนอก ราคาไม่แพง มีข้าว กาแฟ ขนมทำใหม่ทุกวัน
review_227,5,"- เครื่องดื่มมีเมนูให้เลือกเยอะมาก
- อาหารมีเมนูให้เลือกน้อย แต่อร่อยมากเลยค่ะ
ขับผ่านมาย่านรังสิต เห็นชื่อคาเฟ่และการตกแต่งสวย น่าสนใจ เลยเข้ามาทาน
- ถือเป็นครั้งแรกที่ประทับใจมากค่ะ
- ร้านมีมุมถ่ายรุปเยอะค่ะ สบายตา
ปล.น้ำปลาพริกอร่อยมากค่าา ไข่ดาวแบบมาสเตอร์เชฟ555(ข้างนอกกรอบ ไข่แดงเยิ้มมม)"
review_227,5,"ร้านน่ารัก มุมถ่ายรูปเยอะ🥰
เราสั่ง ลาเต้หวาน25% อร่อยถูกใจ ละมุนๆ
มีกล่องสุ่มด้วยนะ😘"
review_227,5,อาหารอร่อย พนักงานน่ารักมาก บรรยากาศดีมากเลย
review_227,5,ชาเขียวสตอเบอรี่และชาไทยสตอเบอรี่อร่อยมากค่ะ สีสันสวยงามน่าทานมาก บรรยากาศร้านดี มีให้สุ่มอาร์ททอยด้วย ประทับใจสุดๆ
review_227,5,กาแฟอร่อย มีระดับความเข้มให้เลือกด้วย ร้านบรรยากาศดี เพลงเพราะ นั่งเล่นหรือทำงานก็ดี ใครอยู่ใกล้แนะนำค่ะ
review_227,5,เป็นร้านคาเฟ่และอาหาร มีขนมและของทานเล่นหลากหลาย เครื่องดื่มมีทั้งกาแฟ ชา และโซดา บรรยากาศภายในร้านดูสะอาดตา โปร่ง มีหลายโต๊ะ สามารถจอดรถรอบๆร้านได้เลยค่ะ
review_227,5,"ร้านเดินทางมาสะดวก ทางผ่านกทม.- รังสิต
เมนูเครื่องดื่ม ขนม อร่อย
ตกแต่งร้านสวย มุมถ่ายรูปเยอะ
สบายตาไปหมด ห้องน้ำก็สะอาด
ประทับใจค่ะ ⭐️⭐️⭐️⭐️⭐️"
review_227,5,ร้านกว้างขวางดี นั่งได้สบายๆ โทนสีขาวดำ กาแฟคั่วกลางอร่อย ราคาไม่แพง เจ้าของร้านใจดี แนะนำค่ะ
review_228,3,ร้านคาเฟ่ในเมืองเอก ร้านน่ารักดี เล็กๆ ตกแต่งสวยเลย พนงบริการดี จอดรถได้ริมถนน เสียดายกาแฟยังไม่หอมถูกใจ ครอฟเฟิ้ลยังเฉยๆค่ะ
review_228,5,คาเฟ่แนวเรโทร ตกแต่งร้านได้ถ่ายรูปสวยทุกมุม แถมกาแฟดีอี๊ก ฟูลฟิวสุดๆ
review_228,5,"แชร์โลคาเฟ่ 📌 วันนี้ขอพามาคาเฟ่ใกล้“ม.รังสิต” เป็นคาเฟ่เล็กๆสไตล์ยุโรปที่มุมถ่ายรูปสวยมาก ถ่ายออกมาเหมือนลูกคุณหนูสุดๆ  - คาเฟ่เมืองเอกใกล้ม.รังสิต หน้าร้านสีเขียวสะดุดตามีป้ายรายการเมนู. - ภายในตกแต่งสไตล์ยุโรปค่อนข้างทึบ แต่ตกแต่งด้วยดอกไฟช่วยให้ถ่ายรูปออกมาลงตัว. - วันธรรมดาอาจะคนเยอะเพราะอยู่ใกล้มหาลัย. - เวลาถ่ายรูปจะเป็น14:00-15:00 แดดจะส่องหน้าคาเฟ่จะได้รูปสวยมากค่ะ. - สามารถจอดรถริมถนนหรือหน้าคาเฟ่ได้เลยค่ะ. - MENU : Bakery ,Coffee and drinks. 1-100฿.-"
review_228,5,"ร้านตกแต่งสไตล์ฝรั่งเศส ด้วยโทนสีเขียวน่ารักมาก บรรยากาศด้านถึงจะไม่กว้างมาก แต่ตกแต่งมาแบบสนใจรายละเอียดทุกตรง มุมถ่ายรูปเยอะมาก มีทั้งเมนูเครื่องดื่มและเบเกอร์รี่ ร้านเงียบนั่งสบาย มีดนตรีเบาๆ นั่งสบายค่ะ

เมนูที่สั่ง Gone With The Wind ราคา 130฿ มีส่วนผสม ice cream vanilla milk salted caramal แก้วนร้มีช็อตกาแฟมาให้ราดเอง แต่ต้องดูน้ำออกก่อน ไม่งั้นล้นแก้ว เราคงดูเยอะไป เลยรู้สึกว่ากาแฟออกเปรี้ยว แต่แฟนชิมบอกไม่เปรี้ยว อร่อยค่ะ ทานกับ ice cream vanilla แล้วดีเลย

อีกแก้วเป็น Casablanca ราคา 130฿ มีส่วนผสมของ Salted carmal milk Whip cream espresso shot แก้วนี้คนไม่ชอบหวานอาจจะไม่ถูกใจ รสชาติออกหวาน จึงมีน้ำเปล่ามาให้ด้วย รสชาติจะหอมๆคาราเมล มีวาฟเฟิลกรอบมาให้ทานคู่กัน ช่วยให้ดื่ใได้เพลิน เหมือนจะลดหวานได้หน่อยค่ะ"
review_228,5,ร้านตกแต่งสวยมาก น่านั่ง ชาไทยกับกาแฟอร่อย รสชาติดี พี่พนักงานผู้ชายบริการดีมาก โดยรวมถือว่าเริ่ด
review_228,5,ร้านสวย น่ารัก ข้างในมุมถ่ายรูปสวย เครื่องดื่มราคาไม่เว่อร์เกิน ครอฟวาฟเฟิลอร่อยจนลืมถ่ายรูป ไว้แวะมาอีก
review_228,5,คาเฟ่บรรยากาศน่ารัก เหมาะกับการเข้ามานั่งชิวๆจิบกาแฟ กินขนม มุมถ่ายภาพเก๋ๆก็เยอะ รสชาติกาแฟก็ดีค่ะ ขนมก็น่าทานทุกตัวเลย
review_228,5,คาเฟ่น่ารักมาก เครื่องดื่มเยอะ ครอฟเฟิลอร่อยมากๆๆ ใครสายคาเฟ่ แนะนำเลย เป็นที่ๆต้องแวะจริงๆ
review_228,5,เมล็ดกาแฟดี ขนมดีทุกอย่าง โดยเฉพาะบราวนี่และครอฟเฟิล
review_228,5,ร้านน่ารักมากกกกกค่ะ  มีความโมเดิร์นพร้อมกับความรู้สึกคลาสสิค กาแฟรสชาติดีมีกลิ่นหอม กาแฟ+ส้มแบบคั้นสดร้านนี้คือที่สุดดด มีเมนูอีกมากมายที่น่าสนใจ ขนมก็หน้าตาน่ารักทุกอัน เข้าไปต้องได้กินหอมของครอฟเฟิลเป็นอย่างแรก เป็นอีก1ร้านที่ถ้าแวะมาแถวมหาวิทยาลัยรังสิต ควรจะแวะมาเป็นอย่างยิ่ง
review_228,5,ร้านน่ารัก บรรยากาศดีค่ะ กาแฟอร่อย เมนู god father หอมcinnamon รสชาติดีเลยค่ะ
review_228,5,ตกแต่งสวยมากกกก กาแฟอร่อย
review_228,5,คาเฟ่น่ารักมากๆ บรรยากาศดีสุดๆเลยค่ะ
review_228,5,กาแฟ และขนมอร่อย และชอบบรรยากาศร้านมาก
review_228,5,กาแฟ ขนมอร่อย ร้านนั่งสบายมาก
review_228,5,ดี
review_228,4,ร้านกาแฟใกล้ ม.รังสิต กาแฟอร่อย ขนมเค้กอร่อย บรรยากาศภายในร้านสะอาด สบาย สวยงาม
review_228,5,"คนรักกาแฟควรลอง!!
ถุงกาแฟดริป น่ารักและคิดอย่างรอบคอบมาก"
review_228,5,positive
review_228,5,positive
review_228,5,positive
review_228,5,positive
review_228,4,positive
review_229,5,ชานมหอมเป็นเอกลักษณ์มากๆ มาทีไรต้องกินประจำเลยค่ะ ร้านน่ารักบรรยากาศดีมีมุมถ่ายรูปน่ารักๆ พนักงานบริการดีมาก พูดจาน่ารักกกกกก😍😍
review_229,5,ร้านชานม ชาฟองหอม ๆ อร่อยหลายเมนูโดยเฉพาะชานมอัสสัมใส่เจลลี่บราวน์เป็นเมนูที่อร่อยเหาะ สั่งทุกครั้ง แนะนำสาขา Future Park ร้านอยู่ชั้น 2 ในโซน Zpell ค่า 👍👍👍
review_229,5,บรรยากาศดี ร้านสวย โทนสีขาว ๆ สบายตา เครื่องดื่มมีให้เลือกหลากหลาย หากเลือกกลับบ้านมีถุงเก็บความเย็นให้ด้วย ปกติทานมัทฉะลาเต้นุ่มชีส หรือมะพร้าวน้ำหอมปั่นนุ่มชีส วันนี้เห็นมีคูปองของสมาชิกเลยลองแลกดู ได้ชาไทยคาราเมลไลซ์ไข่มุกมาทาน เมนูนี้ต้องลดความหวานเพิ่มจากปกติทาน 50% ก็ยังหวาน พนักงานให้คำแนะนำดี
review_229,5,กินตั้งแต่ร้่านเปิดใหม่ๆ ไข่มุกที่นี่คือหนึบหนับ ส่วนตัวชอบนมน้ำตาลแดงที่สุดด สาขาในห้างที่นั่งเยอะแอร์เย็นสบาย พนักงานพูดจาเพราะทุกคนบริการดีครับ
