id_review_main,review_rating,review_text
review_233,4,น้องเมทน่ารักมากก อาหารอร่อย บรรยากาศโมเอะๆ >//////<  ถ้ามีโอกาสจะมาหาอีกค้าบบ 💕💕 Lucia~~ …
review_233,5,คุณเมดน่ารักมากๆเลย บริการดีมากๆเลยค่าาา อาการอร่อยมากๆเบย
review_233,5,น้องเมดเอนเตอร์เทนบริการดีมาก อาหารอร่อย แนะนำเย้ย🙈
review_233,5,ก็น่ารักดีนะคะ เมดก็แบบเป็นกันเองสุดสุด อาหารก็อร่อยนะคะ อาหารน่ารักมากเลยค่ะไม่กล้ากินเลยแต่ฟาดเรียบค่ะ ใครมานะคะแนะนำให้สั่งข้าวหน้าไก่ทอดค่าาา
review_233,5,บรรยากาศดีมากกกค่ะพี่เมทน่ารักสุดๆบริการดีมากๆอาหารก็อร่อย11เต็ม10เลยย
review_233,5,น้อง Maid น่ารักมากๆ เลยค่า บริการดีมากๆ live สนุก 🫶🏻
review_233,5,น้ำอร่อยมากค่าา น้องเมดน่ารักมากด้วยบรรยากาศน่ารักสุดๆ อยากให้ลองมากันดูนะคะผ่อนคลายมาก💖🌷
review_233,5,บริการดีค่ะ น้องเมดน่ารักทุกคน ของหวานอร่อย สั่งเป็นเซ็ตคุ้มกว่า แนะนำค่ะ เริ่ดๆๆๆๆ อีก6เดือนเจอกันค่ะ จะมาใช้บัตรดูโชว์ฟรี😂💓💓💓
review_233,5,น้องเมดน่ารักมากๆครับ อาหารก็อร่อยย🤍
review_233,5,น้องเมดน่านักมากค่ะฮันนี่โทสต์อร่อยยย
review_233,5,น้องเมดน่ารักบริการดี มาอุดหนุนกันเยอะๆนะ
review_233,5,น้องเมดน่าร้ากกกกก เป็นกันเองมาก ๆ ของหวานก็อร่อยสุด ๆ
review_233,5,อาหารอร่อยมากกกก พี่ๆเมดก็น่ารัก บรรยากาศดีสุดๆ ให้สิบเต็มสิบเลยย
review_233,5,พี่ๆเมดน่ารักกันมากๆเลยค่า อยากจะมาทุกวันเลยฮือ🥹🫶🏻💖✨️
review_233,5,อาหารอร่อยมากๆคับ วันนี้ได้มาลองทานอาหารฝีมือ อายาเสะ กับ พี่สาว อร่อยมาก้ลยคับบ🤓
review_233,5,น้องเมดน่ารักมาก อาหารก็อร่อยมากด้วย🥰 …
review_233,5,อาหารอร่อยมากไม่เเพงไปไม่ถูกไป น้องเมดคือน่ารักมากๆ เฟรนลี่สุดๆน่ารักทุกคนเลย
review_233,5,น้องๆ น่ารักเป็นกันเอง บรรยากาศร้านน่ารักดีค่ะ
review_233,5,ข้าวอร่อยมาก เมนูหลากหลายดีคนับ น้องเมดน่สรัก เป็นกันเองครับ
review_233,5,เมดน่ารักมากค่ะ อาหารอร่อย
review_233,5,"น่ารักมากครับมาทันโชว์รอบสุดท้ายสนุกร่าเริง อาหารอร่อยครับ คุ้ม ไว้จะมาใช้บริการใหม่ครับ,,,🥰🥰"
review_233,5,ร้านน่ามักๆๆๆ น้องเมดบริการดีมากๆ สนุกถือว่าเป็นการเปิดประสบการณ์ใหม่ๆที่พีคดีฮะ💖
review_233,5,พี่เมดน่ารักมากก อาหารก็อร่อยย
review_234,5,"วันที่ 31 ตุลาคม 2566
เราสั่งชาเขียวปั่น หวาน 50%
อร่อย กลมกล่อม เหมือนเดิมไม่เปลี่ยน
ปกติจะส่งเดลิเวอรี่ สาขา นี้ บ่อยๆ
แต่วันนี้ มีโอกาส เลยแวะมาสั่งเองที่ร้าน
ร้านไม่ใหญ่มาก มีที่นั่งจำกัด แต่ทำเร็ว
รอ...เครื่องดื่มไม่นาน ชอบมากกกกกกก"
review_234,5,"พนักงานน่ารักบริการดี  ยิ้มแย้มแจ่มใส
เครื่องดื่ม อร่อยกลมกลอม"
review_234,1,กิน amazon มาหลายที่ เพิ่งเจอที่นี่ที่แรก ที่พนักงานพูดกับลูกค้าไม่ดี เป็นพนักงานผู้หญิงคนอ้วนๆ อยากให้บริษัทช่วยอบรมพนักงานใหม่ค่ะ
review_234,4,"วันนี้เข้าไปซื้อ พนักงานหน้าร้านไม่มี ต้องเข้าไปตามออกมาชงให้... 😂

สั่งชาเขียวไป ชงอร่อยดีนะ เข้มข้นดีค่ะ 👍"
review_234,4,มาตราฐานเหมือนสาขาอื่น
review_234,5,ชาเขียวคือเดอะเบส
review_234,4,positive
review_234,1,nagative
review_234,5,positive
review_234,5,positive
review_234,5,positive
review_235,5,"ร้านสวย บรรยากาศดี อาหารอร่อย น้ำอร่อย อย่างนี้ต้องมาซ้ำ

เมนูค่อนข้างน้อยแต่อร่อยทุกเมนูเลย มีเค้กด้วย

มีที่จอดรถ มีโต๊ะนั่งเยอะเลย มีมุมถ่ายรูปหลายมุม

ร้านหยุดทุกวันพุธ"
review_235,5,แนะนำชิสึโอกะ มัทชะค่ะ อร่อยมาก ไข่กระทะก็อร่อย จัดร้านดี ปกติสั่งไลน์แมนประจำ พึ่งลองมาร้านครั้งแรก
review_235,5,บรรยากาศดี  ตกแต่งร้านสวยงาม  ครีม คริสมาสต์  Happy new year   เหมาะสายถ่ายภาพสวยๆ นั่งซิวๆ ฟังเพลง สบายๆ  มีที่จอดรถ เข้ามาในซอยเจอร้านเลย  สายรีวิวต้องมาเลยนะครับ แนะนำต้องแวะมา พนักงานน่ารักทุกคน  บริการดี
review_235,5,อาหาร เครื่องดื่ม ของหวาน รสชาติดี ร้านน่ารักมาก มีที่จอดรถ ที่นั่งค่อนข้าง เยอะ ราคาไม่แพง เค้กอร่อยมาก
review_235,5,"ร้านกาแฟอยู่ในซอย เข้าไปนึกว่าจะหาที่จอดรถยาก
ถึงร้านมีที่จอดรถเยอะมาก
ร้านตกแต่งสวย กาแฟราคาไม่แพง รสชาติดี"
review_235,5,ร้านกาแฟน่ารัก อยู่ท่ามกลางอพาร์ตเม้นท์รายล้อม กาแฟหอมอร่อยมาก น้ำชงแบบอื่นก็หอม ชีสเค้กอร่อยไม่หวานมาก
review_235,5,"อาหารในร้านมีหลากหลายทั้งเมนูอาหาร เครื่องดื่ม และขนม
รสชาติดี ราคากลางๆ

ตัวร้านตกแต่งสวยงาม มุมถ่ายรูปเยอะ
มีเปลี่ยนธีมไปตามเทศกาลต่างๆ

การบริการของพนักงานค่อนข้างดี

ห้องน้ำภายในร้านสะอาด และสวยงาม

มีที่จอดรถรอบตัวร้าน รองรับได้หลายคัน"
review_235,5,ที่ คนคลองหกต้องมาเช็คอินและชิมของอร่อยๆ ด้วยวัตถุดิบเกรดคุณภาพ อร่อยคุ้มค่าราคา มุมนั่งที่สบายตัวถ่ายภาพได้สวยงาม ประทับใจ มาทุกครั้งที่คิดถึงเสมอ
review_235,5,กาแฟอร่อย ขนมอร่อย เงียบสงบ นั่งทำงานได้ ให้เป็นที่ 1 ในย่านนี้เลยจ้า
review_235,4,ร้านตกแต่งสวยงาม มีที่จอดรถพร้อม บริการดีมาก กาแฟน้ำมะพร้าวอร่อย เค้กก็อร่อย แต่ลาเต้ร้อนยังไม่ถูกปาก
review_235,5,คาเฟ่ลับๆ ย่านคลองหก ราชมงคลธัญบุรีอยู่ในซอยหาไม่ยากปักหมุดตรง ร้านสวยตกแต่งดี โทนขาวตัดน้ำตาล ห้องแอร์มี 2ชั้น เครื่องดื่ม กาแฟ ขนมต่างๆ ที่สั่งมาโอเค ราคาเหมาะสม พนง บริการดี ห้องน้ำดี ที่จอดรถเยอะ แต่ทางออกมุมอับต้นไม้บังฝากทางร้านดูแลหน่อยนะครับ ออกยาก รถเยอะอันตรายกับน้องๆนศ. โดยรวมชอบครับ 8/10
review_235,5,คุณภาพดีเยี่ยม ร้านสะอาด ราคาคุณภาพ กาแฟ ขนมอร่อยมากให้คะแนนเกินร้อย
review_235,5,กาแฟดีเลยครับ มีเมล็ดให้เลือกเยอะมาก แกงกะหรี่ก็อร่อยครับ
review_235,4,"กาแฟหอม รสชาติเข้มข้น
ขนมอร่อย
ชอบบรรยากาศของร้านมากครับ จัดร้านสวย มุมที่นั่งเยอะ มีที่นั่งชั้นบนด้วย
โดยรวมแนะนำครับ"
review_235,4,"เป็นคาเฟ่เล็กๆในเมือง บรรยากาศดี
อาหารไม่แพง อร่อยด้วย
ที่จอดรถน้อยไปนิดหนึ่งครับ
พนักงานบริการดีมากครับ"
review_235,5,เค้กและน้ำอร่อยมากค่ะ ร้านน่ารัก พนักงานบริการดี ยิ้มแย้ม 🥰🥰
review_235,5,"คาเฟ่ชั้นยอด ที่ตั้งอยู่ใจกลางหอพักติดมหาลัยดังหลักย่านคลอง 6
รสชาติกาแฟเป็นของจริง อาหารและของหวานรสชาติดีมากๆ หลายเมนูเลยล่ะ แถมมีความหลากหลายมากๆ มากี่รอบๆก็ไม่น่าเบื่อครับ
ร้านสวยถ่ายรูปสวยครับ"
review_235,5,ร้านเล็กๆแต่บรรยากาศดีมาก ตกแต่งร้านได้สวยงาม กาแฟอร่อย ของหวานก็อร่อย ด้านข้างร้านน่าเสริมเป็นโซนเอาท์ดอร์เพิ่มที่นั่งอีก ทำเป็นมุมถ่ายรูปด้านนอกน่าจะดี
review_235,5,ร้านโปร่งกว้างสะอาดดี กาแฟเค้กอร่อยดี
review_235,5,ร้านไม่ใหญ่มาก บรรยากาศดี มีที่นั่งเยอะพอสมควร ที่จอดรถสะดวก เดินทางง่าย เครื่องดื่ม และ ของหวานรสชาดดี จัดร้านได้น่ารัก สะอาด คนไม่พลุกพล่าน น่านั่งอ่านหนังสือมาก มีโอกาสจะแวะไปอีกครับ
review_235,4,ร้านเล็กๆ มีสองชั้น มานั่งทำงานหรือนั่งเล่นได้ค่อนข้างเงียบ มาร้านนี้อยู่ได้ทั้งวันมี อาหารคาวหวานครบทำงานได้ยาวๆไป วันนี้จัดแกงข้าวกะหรี่ไข่ข้นไปหนึ่งกรุบรสชาติกลางๆไม่เผ็ด ถ้ามีพริกญี่ปุ่นให้น่าจะฟินๆ กาแฟเลือกได้คั่วกลางคั่วเข้ม ครั้งหน้าจะมาชิมเค้กกะขนมหวาน^^
review_235,5,บรรยากาศดี อาหารอร่อย พนักงานบริการดี มีที่จอดรถ
review_235,5,ร้านอยู่ในซอยขับเข้ามานิดเดียว มีที่จอดรถเยอะ สะดวก ห้องน้ำสะอาด วันนี้มากินข้าวแกงกระหรี่หน้าตาดี รสชาติอร่อยไม่เลี่ยนไป หมูทอดกรอบ ส่วนน้ำก็ชาเขียว กาแฟมีคั่วกลาง กับคั่วเข้ม ถ้ามาแถว คลอง 6 ขอแนะนำร้านนี้ครับ
review_235,5,อาหารอร่อย กาแฟดีมาก ร้านสวย บรรยากาศดี บริการดีมาก 👍
review_235,5,ร้านสวย บรรยากาศดี สบายๆ กาแฟรสชาติเยี่ยม หอมละมุน ราคาไม่แพง
review_235,5,"ร้านน่ารักมากกก
ขนมอร่อย บรรยากาศดีค่ะ"
review_235,5,ร้านน่ารัก บรรยากาศดี ขนมอร่อย
review_235,5,ร้านสะอาด บรรยากาศดีมาก เพลงดี อาหารและเครื่องดื่มรสชาติดีมากๆ ถูกใจมากครับ
review_235,3,"กาแฟและชาหวานมากกกก ต้องสั่งหวานน้อยนะ
เค้กมะพร้าวดี
บรรยากาศดึ
เมนูหลากหลาย แต่งอลกาแฟมากกก แก้วแรกของวันด้วย 🥲🥲 กินไม่หมด"
review_235,5,สถานที่สวยค่ะ สไตล์นอร์ดิก ตกแต่งร้านได้สวยค่ะ อาหารและเครื่องดื่มราคาไม่แพง มีเมนูให้เลือกหลากหลายค่ะ
review_236,5,positive
review_237,5,"ร้านของ mister coffee ที่เป็นทั้งศูนย์เรียนรู้ของพนักงาน และเป็นการกาแฟที่หน้าร้าน แก้วละ 35 บาท
ราคาถูกมาก ลูกค้าเข้าตลอด เป็นการเรียกลูกค้าได้ดี และ เทรนนิ่งพนักงานไปในตัว
ภายในร้าน ตกแต่งสวย น่ารัก  มินิมอลดีครับ
ที่นั่งไม่เยอะ เหมาะสำหรับซื้อกลับบ้าน"
review_237,5,กาแฟอร่อย ราคาไม่แพง มีเมล็ดให้เลือก มีเมล็ดกัวเตมาลา แก้วละ 69 บาท ขายเครื่องชงกาแฟ เมล็ดกาแฟ
review_237,5,พนักงานสอนดีมาก มีความเป็นกันเอง ใส่ใจลูกค้า สถานที่เหมาะสมหว้างขวางมีที่จอดรถ มีสอนค้าให้เลือกครบครัน หน้าร้านมีเครื่องดื่มขายราคาย่อมเยามากเมื่อเทียบกับคุณภาพและเครื่องมือในหารชงกาแฟ
review_237,5,ร้านสวยสะอาดตา บริการดี กาแฟอร่อย ราคาย่อมเยา
review_237,5,เน้นขายกาแฟครบวงจร กาแฟเลยถูกมากกกกกกกก อร่อยมากกกกก เม็ดคั่วเอง
review_237,4,กาแฟรสชาติดี ราคาถูกเหลือเชื่อ ขาดแต่พื้นที่ให้นั่งชิลล์ แต่รสชาตินี้ ราคานี้ โคตรคุ้มครับ (ถ่ายจากหน้าร้าน ใกล้ๆร้านขายยา)
review_237,5,"📌 เรามาล้างโถบดเมล็ดกาแฟที่นี้ค่ะ พี่บริการดีให้คำแนะนำดีมากค่ะเรื่องของโถบดกาแฟ
📌 มีเครื่องกาแฟ และโถบดเมล็ดกาแฟขายหลายตัวเลยค่ะ
📌 มีบริการซ่อมเครื่องกาแฟด้วย ไว้จะมาลองชิมเครื่องดื่มนะคะ ส่วนตัวคิดว่าบริการดีมากค่ะ น่ารัก"
review_237,2,"ตัดสินใจเลยว่าถ้าว่างจะมาร้านนี้ เพราะมีคำว่า Specialty  คือเช้ามา mood กำลังดี เจอการต้อนรับที่แบบ เหมือนหงุดหงิดอะไรมา แล้วมาลงที่ลูกค้าด้วยน้ำเสียงที่พูด
กำลังหาเมล็ด ว่าจะกินเมล็ดอะไรดี แต่มันชวนให้แบบรีบร้อนซึ่งตอนนั้นไม่ได้มี ลค เยอะ ไม่ได้รีบอะไรด้วย

หลังจากโอนเงินเรียบร้อย บอกว่าส่งสลิปเข้าไลน์ด้วยค่ะ ? เอ้า นี่ฉันเป็นผู้บริโภค แต่ต้องส่งสลิปเข้าไลน์ร้านคุณ มันเหมือนเป็นการผลักภาระให้ผู้บริโภค  คือต้องมานั่งเพิ่มเพื่อน ซึ่งเหมือนเป็นไฟท์บังคับว่าต้องเพิ่มเพื่อนอะ ถ้าจะโอนเงิน     ทั้งที่ที่อื่นคือแบบ พนง. ถ่ายรูปเป็นหลักฐาน อะไรกัน   ถ้าเรื่องของการสะสมคะแนนอันนี้เข้าใจได้เป็นอย่างมาก แต่การโอนเงินจ่ายค่าสินค้า แต่ต้องมานั่งเพิ่มเพื่อน

พอถามไม่เพิ่มได้มั้ย เช็คเอาได้มั้ยคะ บอกไม่ได้???

แล้วพอแสกนเพิ่มเพื่อนไม่ติด ก็บอกงั้นสะดวกจ่ายเงินสดมั้ย  ประเด็นคือจ่ายไปแล้ว

จากนั้นก็เลยบอกให้น้อง (ไม่รู้ว่าน้องพาร์ทไทม์มั้ย) งั้นเช็คสลิปลูกค้า

คือแบบ สงสารน้องนะ ต้องมารองรับอารมณ์ผู้ใหญ่คนนึง  และแบบ เราไม่ได้อะไรเลยนะกับน้อง แค่รู้สึกว่า ถ้าคุณอารมณ์ไม่ดีอะไรมา อย่ามาลงกับลูกค้า คุณไม่รู้ตัวหรอก แต่ทุกอย่างมันแสดงออกมาทางน้ำเสียง

และถ้ามันเป็นไฟท์บังคับไม่ได้จริงๆว่าต้องเพิ่มเพื่อนไลน์เท่านั้นถึงจะโอนจ่ายได้  แต่
1.มันไม่ใช่การสะสมแต้มหรือเปล่า
2.มันเป็นการผลักภาระให้ผู้บรืโภคหรือเปล่า
3. ถ้ามันไม่ได้จริงๆ พอแสกนไม่ติด แล้วแค่มาดูทำไม

ทำระบบง่ายๆให้พนงถ่ายรุปสลิปแล้วส่งเข้าไลน์กลุ่มแบบที่อื่นคือไม่ได้หรอ

ที่สำคัญสุดเพราะน้ำเสียงที่คุณป้าพูดมานี่แหละ มันทำให้ทุกอย่างแย่ไปหมด mood ในวันนี้ของลูกค้า คือจบเลย เหมือนเริ่มต้นวันด้วยอารมณ์ดีๆทกะจะอยากลองร้านกาแฟใหม่ดีๆ มาเจอแบบนี้ พังหมดวันนี้ ส่วนเรื่องของรสชาติกาแฟ เราไม่ได้ตืดอยู่แล้ว เราแค่อยากลองร้าน specialty แต่ตอนเราไปมีเหลือแค่ เอธิโอเปีย ก็เลยกิน แต่อารมณ์มันไม่ได้ละอะ กาแฟเหมือนเป็นคั่วเข้มซึ่งคนไทยแถวนี้ส่วนใหญ่กินแบบนี้อยผุ่แล้ว น่าจะชอบ ส่วนเทสเราเป็นกาแฟคั่วอ่อน;กลาง
ร้านคุณดีมากแหละ เราแค่เข้าไปผิดเวลา ผิดอารมณ์ แต่มันแบบ first impression อะคุณ ขอบคุณค่ะ"
review_237,5,"GOOD LOCATION
GOOD COFFEE
GOOD PRICE

ราคา 40-60 บาท

แอร์เย็นๆ นั่งพักหลังจากลง หรือรอเพื่อนขึ้นรถเมล์ได้ :)"
