id_review_main,review_rating,review_text
review_229,5,เป็นร้านชานมที่อร่อย บรรยากาศก็ดี สามารถนั่งชิลล์ได้ยาวยาวเลย ไข่มุกเด้งมากทำจากโมจิเด้งแบบเด้งเด้งเด้งเด้ง พนักงานเป็นกันเองสุดสุด
review_229,5,ร้านไม่ใหญ่มาก อยู่ในห้าง มีที่นั่งพอประมาณ บรรยากาศในร้านดี แต่งสวยสไตล์มินิมอล ชาไทยรสชาติเข้ม คนไม่ชอบหวานสั่งหวานน้อยนะ ถ้าหวานปกติ จะติดหวานไปหน่อย ราคาก็แอบบสูงไปหน่อย แต่ถ้าเทียบกับรสชาติก็โอเค สมเหตุผล พนักงานบริการดี
review_229,5,สั่งชาองุ่นนุ่มชีส ชาหอมชีส นัวๆ อร่อย ได้น้ำได้เนื้อเต็มๆ นั่งพักกินชาไปผ่อนคลายมาก
review_229,5,ชานมอัสสัม รสชาติดี พนักงานบริการดี พูดจาดี สาขาฟิวเจอร์พาร์ค รังสิต มีที่นั่งในร้าน พนักงานแนะนำเมนูได้อย่างดีเยี่ยม รวมถึงการสะสมแต้มต่างๆ
review_229,5,กินสาขานี้ตลอด พนักงานบริการดีมากกกก น้ำรสชาติคงที่ไม่เคยเปลี่ยน ใครจะกินแบร์เฮ้าต้องสาขาฟิวเท่านั้นน🩷🤎🧋 …
review_229,5,ร้านสวย น่ารัก พนักงานบริการดี สะอาด อยู่ในศูนย์การค้า สะดวกสบาย คิวไม่เยอะรอไม่นานเท่าไหร่
review_229,5,ร้านน่ารักมาก บรรยากาศดี เหมาะกับการนั่งชิลสุดๆ ราคาเข้าถึงได้ เเละพี่พนักงานน่ารักมากครับ
review_229,5,เครื่องดื่มอร่อยมากค่ะ ร้านสะอาด มีที่ให้ชาร์ตแบตด้วย🥰 …
review_229,5,ชานมอร่อยมาก พนักงานบริการดี บรรยากาศร้านดีคนมานั่งทำงานนั่งเรียนกันเยอะ
review_229,5,มะพร้าวหอมปั่นมัจฉะอร่อยมากชอบมากๆค่ะแพ็คเก็จก็สวยร้านดูสะอาดสะอ้านมากๆ
review_229,5,บรรยากาศผ่อนคลายมากค่ะ พนักงานบริการดี ชานมหอมอร่อย ประทับใจค่ะ
review_229,5,ชอบขนมเหมือนฝันที่สุดค่ะอร่อยมากๆเป็นลูกค้ามาได้ประมาณหนึ่งปีแล้วค่ะชอบมากขอบคุณค่ะ
review_229,5,บรรยากาศ ร้านดี พนักงานบริการแนะนำ บริการดีมากค่ะ ชามะลิยูสุคือดีมาก
review_229,5,อร่อยมากค่ะ สาขานี้บริการดีมาก สะอาดมากคับบ💘🌟 …
review_229,5,ชานมไข่มุกอร่อยมากค่ะ พนักงานบริการสุภาพแนะนำดีมากค่ะแม้ลูกค้าจะเยอะ
review_229,4,"รอคิวสั่งค่อนข้างนาน เหมือนเครื่องสั่งช้าหรือมีปัญหาไม่แน่ใจ แต่นเำออกเร็วค่ะ ยืนรอคิวสั่งนานกว่ารอเครื่องดื่มอีก
ร้านไม่รับเงินสด ไม่แน่ใจมีป้ายแจ้งมั้ย มารู้ตอนจะจ่าย …"
review_229,5,ชานมอร่อย กินประจำ พนักงานน่ารักบริการดีค่ะ🫶🏻 …
review_229,1,เข้าใช้บริการวันที่ 20/4/68 เคยทานครั้งแรกเลยไม่รู้รสชาติของชีส ไม่ทราบว่าชีสของทางร้านมีรสชาติยังไงคะ ทานไปครั้งแรกยังไม่รู้สึกเพราะทานแต่ข้างล่าง พอทานตรงชีสเจอชีสที่เปรี้ยวแบบเปี้ยวมากๆ มีส่วนที่เค็มไม่เท่าไหร่ แบบนี้บูดหรือยังไงคะ เพราะชีสคนละรสชาติกันเลย ความประทับใจแรก 0 ไปเลยค่ะ😭😭 …
review_229,5,ชานมกับชามะลิอร่อย ร้านบรรยากาศดีนั่งสบาย เครื่องดื่มรอไม่นาน
review_229,5,"ฤกษ์งามยามดี ได้กินสักทีชานมไข่มุก วันนี้เรามากันที่ร้านชานมไข่มุกร้านนึงที่ตั้งอยู่ชั้นบนสุดของห้างฟิวเจอร์พาร์ครังสิต ร้านนี้มีชื่อว่า ""Bear House"" ร้านชานมไข่มุกชื่อดังที่มีชื่อเสียงมานมนาน แต่เราก็ยังไม่เคยได้มาลองทานกันสักที …"
review_229,5,วันนี้ที่Bearhouse มีกิจกรรม ร่วมกับ เกมvalorant ที่ชอบทั้งสองเลย ตื่นเต้นมากๆๆ เราสั่งน้ำ มะพร้าวหอมปั่นมัจฉะไป ละมุนสุดๆๆแถมมีเนื้อมะพร้าวด้วย อยากให้ลอง และไปร่วมกิจกรรมกัน เมื่อกิจกรรมจะถึง 9 มีนาคมนี้นะ
review_229,5,พนักงานบริการดีมาก ร้านน่ารัก และอร่อยมากๆค่ะ
review_229,5,ชอบไข่มุกแบร์เฮ้ามากก การจัดการบริการดี ไม่รอคิวนาน
review_229,5,พนักงานน่ารักมากค่ะ บริการดีทุกคน บรรยากาศในร้านที่นั่งเยอะค่ะ
review_229,5,อร่อยมากค่า น้ำไม่หวานไป เจลลี่นุ่มเด้งดึ๋ง แอร์ฉ่ำ 😻 …
review_229,5,ร้านสวยน่ารัก ชาอร่อยมากค่ะ😍 …
review_229,4,เคยกินชาไข่มุกอีกสาขานึง อร่อยดีค่ะ แต่เราว่ามันแพงไปหน่อยย วันนี้มากินเมนูใหม่ของทางร้าน เห็นรีวิวเยอะมากก เลยขอลองสักหน่อย เคยกินมาหลายร้าน  ที่นี่อร่อยสุดสำหรับชาผลไม้ครีมชีส (สำหรับเราค่า) อีกแบรนด์ยังสู้ไม่ได้ …
review_229,5,ซอฟโยเกิร์ตนุ่มชีสสส มันดีม้ากก เพิ่มหนึบน้ำผึ้งด้วยคือที่สุดดด 💗💗💗💗 …
review_229,5,เป็นชามะลิที่หอมเลยค่ะ ที่ร้านบริการดีมากๆเลย
review_229,5,บริการดีไม่รอนานชอบชาชีสส้มหอมมาก
review_229,5,กินประจำค้า ชานมอัสสัมไข่มุกโมจิ หวาน 25 คือ เดอะเบส ค่า
review_229,5,ชาหอม อร่อย บริการดี สถานที่ดีค่ะ ✨⭐️
review_229,2,"รอนานมาก แต่ละคิวผ่านไปช้ามาก ขนาดซื้อกลับไม่ได้นั่งกินที่ร้าน
ตอนจ่ายเงินบอกรอครึ่งชม. รอจริง 1ชม.ยังไม่ได้สินค้า แถมจ่ายเงินไปแล้ว ไม่เอาก็ไม่ได้ …"
review_229,5,ร้านกว้าง มีที่นั่งเยอะมาก รสชาติอร่อยค่ะ
review_229,5,บรรยากาศภายในร้าน ดี โล่งสบาย เครื่องดื่ม อร่อย พนักงานบริการดีค่ะ
review_229,5,ชอบชานมไข่มุกที่นี่มากกกก ไข่มุกโมจิหนึบหนับ อร่อยยย
review_230,4,ร้านพื้นที่กว้าขวาง มีต้นไม้ใหญ่มีชิงช้าให้นั่งเล่น บรรยากาศดี รอน้ำนานนิดนึง
review_230,4,"ร่มรื่นด้วยต้นจามจุรีขนาดใหญ่ เป็นธรรมชาติดี
ภายในร้านเน้นเป็นเก้าอี้หนัง ดูย้อนยุค และที่นั่งริมระเบียง ทีนั่งเยอะ มีที่จอดรถ แต่ถ้าฝนตกจะเฉอะแฉะ
ให้จอดหน้าร้าน  ร้านอยู่ในซอยนิดหน่อย ไม่ได้ติดถนน"
review_230,5,บรรยากาศดีมากค่ะ เครื่องดื่มเยี่ยมถูกใจคุ้มราคา
review_230,4,บรรยากาศร้านร่มรื่นดีมากเลยยยยยย  ต้นไม้ใหญ่เยอะดี  เด็กๆนักศึกษา  มานั่งชิล เยอะดี  เมนูหลากหลาย  ราคาปกติ  พนักงาน น่ารักดี ยิ้มแย้ม เป็นกันเอง  มีที่จอดรถ ด้านหน้าและด้านข้าง  เป็นร้านที่สามารถนั่งชิลได้ทั้งวัน  ผ่านมา  ไม่รู้จะนั่งรอตรงไหน  ก้อแวะเลย  สบายๆๆ😍😍😍😍😍😍🥰😍😍😍😍😍🥰🥰🥰🥰
review_230,5,ร้านตกแต่งสวย มาเสาร์อาทิตย์คนจะเยอะ ราคาไม่แพง มีwifi ฟรี มีห้องประชุมด้วย แต่บางโต๊ะนั่งทำงานไม่ค่อยสะดวกเท่าไหร่ มีที่จอดรถหน้าร้าน ไม่ไกลจากมอ ถ้ามานั่งกินกาแฟชิลๆก็แนะนำเลยจ้า
review_230,5,"ร้านกาแฟน่านั่ง แถวรังสิตคลอง 6
…บรรยากาศนั่งในสวน
ต้นจามจุรีใหญ่ ภายในแอร์เย็น โซฟาน่านั่ง
กาแฟดี มีกลิ่นหอม เข้มข้น
มีทั้ง zone outdoor
Indoor
กาแฟราคากลางๆ เข้าถึงได้"
review_230,4,กาแฟ สำหรับ คอกาแฟ มีให้เลือก /กาแฟ ต่างประเทศ แบบselection /ลองสั่งกาแฟดริปดรายโปรเสส /ฟิน/กลมกล่อม นุ่ม มาก สถานที่แนว ดาร์กลอฟท์ โดนใจวัยรุ่น /นักศึกษา
review_230,5,"กาแฟอร่อย
ราคาไม่แพง
พื้นที่ร้านโล่งโปร่ง
นั่งขิวๆ หรือประชุมก็ดีงาม
พนักงานบริการดี"
review_230,4,"How to Cafe

คาเฟ่เล็กๆ อยู่แถวปทุมธานี
ถ้าได้แวะมาเที่ยวพิพิธภัณฑ์พระรามเก้า
แนะนำว่าให้แวะมา ห่างกันประมาณ 2 โล

ทางเข้าจะเล็กๆ ต้องสังเกตดีๆ
ที่จอดรถมีไม่มาก มีที่ข้างๆ แต่ฝนตกจอดไม่ได้

เข้าด้านในบรรยากาศดี
มีสนามหญ้ากว้าง พร้อมด้วยต้นไม้ใหญ่
มีมุมให้ สาย Cafe hooping ได้ถ่ายรูปเยอะเลย

มีทั้งอาหารและขนมเบเกอรี่ให้เลือก
เครื่องดื่มมี กาแฟสดแล้ว
ยังมีน้ำซ่าที่สกัดจากเปลือกกาแฟอีก
ลองกินน้ำซ่าครั้งแรก ก็อร่อย แปลกๆดี

#TravellingAsACouple
#TravellingAsACouplePlus1"
review_230,5,บรรยากาศร่มรื่น ที่นั่งสะดวกสบาย กาแฟอร่อยมากๆ
review_230,4,When we want to be happy with being able to sit comfortably with good place at How to caffee ร้านกาแฟย่านคลองหก น่านั่ง บรรยากาศร่มรื่น
review_230,5,คาราเมลมัคฯหอมอร่อย ชาไม่ค่อยมีกลิ่น พนักงานน่ารักบรรยากาศดีรีแรกซ์ ปังปิ้งดี
review_230,5,ร้านสวย กาแฟรสชาติดี ชามะนาวก้ออร่อย ร้านนั่งสบายๆ ต้นไม้ใหญ่สวยมากค่ะ
review_230,4,"ร้านน่ารัก ร่มรื่น เหมาะแก่การมานั่งชิว
มีมุมถ่ายรูปเยอะ"
review_230,5,บรรยากาศดี อาหารอร่อย พื้นที่ถ่ายรูปน้อยไปนิด
review_230,5,บริการดี เค๊กและกาแฟอร่อยถูกใจมากค่ะ
review_230,3,นมชมพูที่ไม่หอมกลิ่นสละเลยจางมาก อเมริกาโน่เย็นให้กลิ่นในโพรงปากและรสชาติที่ชัด ไม่เปรี้ยว โกโก้น่าจะลดนมลงหน่อยเพราะไม่เข้มข้นสู้นมเท่าที่คาดหวัง ชามะนาวอร่อยพอดี ปังหยองไม่ร้อนน่าเสียดายค่ะ ของทอดทานเล่นรสชาติปกติทั่วไปเพราะเป็นแบบสำเร็จรูป ทางเข้าที่จอดจะงงๆ นิดหน่อยว่าให้เลี้ยวซ้ายทางเข้าแคบๆ เข้าไปและมีป้ายว่าไม่ให้จอดหน้าร้าน? (ก็เห็นมีคนจอดอยู่ดี) แต่ใครนำรถยนต์ไปแวะล้างรถร้านด้านหน้าติดกันได้เลย จิบเครื่องดื่มรอแบบไม่เสียเวลา การตกแต่งโดยรวมดูดี เมนูเยอะ มีจอให้เลือกอ่านดู แต่ไม่มีภาพตัวอย่าง ให้มโนล้วน อยู่ภายในร้านจะเสียงอื้ออึงดังหน่อยเพราะโครงเหล็ก+กระจก ไม่มีวัสดุผ้ามาซับเสียง นั่งนานก็น่ารำคาญเหมือนกัน ด้านในเซ็ตบาร์นั่งทำงานได้มีชุดเดียว 2-4 ที่นั่ง อยากใช้โน้ตบุ๊คทำงานสบายๆ ต้องนั่งด้านนอกแต่ก็ร้อนล่ะ มีห้องส่วนตัว 1 ห้องต้องสั่ง 300฿ ใช้ได้จำกัดเวลา เซ็ตโซฟา+โต๊ะเตี้ยมีหลายชุดให้เลือก วันนี้มานั่งแอร์ไม่ค่อยเย็นฉ่ำเท่าไหร่ ห้องน้ำแสงสลัว มีกลิ่นท่อและกลิ่นจากชักโครก พนักงานยิ้มแย้มน่ารัก พูดจาดีมาก แนะนำเมนูได้ดี มีไวไฟใช้ฟรี
review_230,4,คาเฟ่เล็กๆ บรรยากาศดี กาแฟพอใช้ได้
review_230,4,กาแฟรสชาดดี มีที่นั่ง ห้องแอร์ และ outdoor ห้องน้ำสะอาด แนะนำเลยครับ ผมชอบมาสั่ง อเมริกาโน่ กินกับ เค้ก หรือวาฟเฟิล แนะนำเลยครับ
review_230,4,บรรยากาศร่มรื่นสงบ อาหารอร่อย กาแฟและเครื่องดื่มมีให้เลือกหลายเมนู เหมาะกับการนังติวหนังสือ ส่งงาน
review_230,5,"พนักงานงานบริการดีห้องน้ำสะอาด
มีที่จอดรถ"
review_230,5,บรรยากาศร่มรื่นมาก เครื่องดื่มและอื่นๆ ราคากันเองมากๆ รสชาติอร่อย ทำให้รู้สึกอยากมาอีก วันหยุดพักผ่อนมานั่งชิวๆที่นี่คนเดียว มันจะโอเคมากๆ
review_230,4,บรรยากาศดีมาก เหมาะกับการที่จะมานั่งคุย นั่งทำงาน หรือแค่นั่งพัก ดื่มชากาแฟทานขนม ถ่ายรูปก็ได้หบากหลายมุม
review_230,5,👨‍👩‍👧ร้านสวย อร่อยทั้งเครื่องดื่มและเค้ก บริหารพื้นที่ดีมาก ที่จอดรถสะดวกและเพียงพอ ปลอดภัยจากโควิดด้วยจ้า 👍👍👍👍👍 …
review_230,3,มาลองร้านใหม่แทนร้านเดิม สถานที่สวยนั่งสบายเหมือนเดิม  เมล็ดกาแฟที่ใช้ส่วนตัวยังไม่ค่อยถูกใจ  คั่วกลางคั่วอ่อน AFTERTAST  แทบจะไม่มีเลย
review_230,5,ร้านน่านั่ง กาแฟอร่อย เค้กอร่อย 💗 …
review_230,5,บรรยากาศดีมากครับ ร้านอยู่ในหลืบในซอก หลังคาร์แคร์
review_230,4,อาหารรสชาติปานกลาง ราคาไม่แพงมาก ที่จอดรถกว้างขวาง ร้านบรรยากาศดีมาก
review_230,5,กาแฟอร่อยมากครับ บรรยากาศ ดีมากๆครับ
review_230,4,กาแฟเข้ม เค้กอร่อย ร้านนั่งสบาย
review_230,5,ร้านน่านั่ง บรรยากาศดี กาแฟดี
review_230,5,บรรยากาศดี เพลงเพราะ ห้องน้ำสะอาด ราคาไม่แพง
review_230,5,บรรยากาศดี กาแฟเข้มสะใจอร่อยกลมกล่อมพอดีเลยครับบบ
review_230,4,บรรยากาศดี นั่งสบาย
review_230,4,กาแฟผ่าน ปังปิ้งหมูหย็องและ สังขยายังต้องปรับอีกนิดจะอร่อยฉ่ำยิ่งขึ้น
review_230,5,แอร์ข้างในห้องเย็นมาก เอาเสื้อกันหนาวมาด้วยถ้าจะนั่งนาน
review_230,5,บรรยากาศดีนะ การตกแต่งร้าน คือชอบ
review_230,5,ราคาไม่แพง รสชาติดี
review_230,4,ปิดให้บริการคะ น่าจะอัพเดทในระบบด้วยนะคะ เพราะ Google map แจ้งว่าเปิดคะ
review_230,2,บรรยากาศดีแต่รสชาติอาหารแย่หน่อย
review_230,5,บรรยายดี น่านั่ง
review_230,3,แสงสว่างน้อยไปนิด แต่อร่อยค่ะ
review_230,5,บรรยากาศดี กาแฟอร่อย😋 …
review_230,4,บรรยากาศดี กาแฟอร่อย...
review_230,5,บรรยากาศดี
review_230,5,ร้านลับ บรรยากาศดี
review_230,5,น่ารัก
review_230,4,สถานที่กว้าง ร่มรื่น
review_230,4,นั่งสบาย ชิวๆ
review_230,4,กาแฟอร่อย
review_230,3,คร้า
review_230,5,ดีงาม
review_230,5,กาแฟอร่อย บรรยากาศดี
review_230,4,กาแฟอร่อย
review_230,5,กาแฟอร่อย
review_230,5,"ฉันเคยไปหลายครั้งแล้วและฉันชอบที่นี่
ฉันพยายามไปทุกวัน
สมูทตี้มะม่วงสั่งพิเศษอร่อยมาก และฉันจะซื้อพรุ่งนี้ด้วย กรุณาเตรียม. คุณต้องมี 11
พอใจมากกับพนักงานที่เป็นมิตรและบรรยากาศสบาย ๆ ของร้านกาแฟ!
เจอกันพรุ่งนี้!

อัปเดต. 5 กุมภาพันธ์ 2568
ฉันเพิ่งกลับมาจากการสั่งซื้อครั้งล่าสุด
ฉันอาศัยอยู่ที่ มทร.ธัญบุรี เป็นเวลาหนึ่งเดือน และได้เยี่ยมชมสนามเบสบอลสมเด็จพระนางเจ้าสิริกิติ์ และ How to Cafe Chat Wheel
ฉันค่อนข้างสนิทสนมกับพนักงานที่เป็นมิตร แต่ก็น่าเสียดายที่ต้องแยกทางกัน
ถ้าฉันมาที่นี่อีกครั้งฉันจะไปเยี่ยมอีกครั้ง
ขอบคุณ"
